Item Category,Description 
Tire,Ring-shaped component that surrounds a wheel's rim
Axle,Central shaft for a rotating wheel or gear
Drivetrain,Every component involved in delivering the power from your legs to the wheels
Chains,Roller chain that transfers power from the pedals to the drive-wheel of a bicycle
Pedal,Part of the bicycle you apply pressure to in order to move forwards
Saddle,Seat that forms one of the contacts point between the ridder and the bike
Bearing,Used to reduce friction at various points on the bike
Other,Other
